{
  "id": "frostfall",
  "name": "Frostfall",
  "theme": "Viking Tundra",
  "levelRange": {
    "min": 31,
    "max": 45
  },
  "playOrder": 3,
  
  "description": "An endless winter grips this dimension. Vikings raid, survive, and honor their ancestors through battle. The cold is merciless, but so are those who survive it.",
  
  "atmosphere": {
    "visual": "Frozen tundra, longships, snow-covered mountains, aurora",
    "mood": "Harsh, proud, survivalist",
    "danger": "Extreme cold, raiders, corrupted berserkers"
  },
  
  "charles": {
    "name": "Farmer Charles",
    "title": "The Provider",
    "description": "In a land of warriors, he chose to feed them. His quiet strength has saved more lives than any sword.",
    "wisdom": "Simple truths and provision",
    "backstory": "When the endless winter came, most took up weapons. Charles took up a plow. His farms beneath the ice feed the resistance."
  },
  
  "legendaryNike": {
    "name": "Viking Nike",
    "title": "The Frost-Blooded",
    "description": "The greatest warrior of Frostfall. Undefeated in combat, he seeks only worthy opponents.",
    "corruptionReason": "The boredom of having no equal",
    "abilities": ["Berserker Rage", "Frost Resistance", "Rally Cry"],
    "freedBy": "Showing him that true strength is protecting others"
  },
  
  "harbinger": {
    "name": "Erik",
    "title": "The Eternal Raider",
    "emotionalTheme": "Strength without purpose",
    "corruptionReason": "Glory that became emptiness",
    "description": "Raided a thousand shores, won a thousand battles. Found nothing worth keeping. Nolem offered him endless war."
  },
  
  "locations": [
    {
      "name": "The Frozen Shore",
      "type": "Entry Point",
      "description": "Where dimensional travelers first feel Frostfall's bitter cold"
    },
    {
      "name": "Farmer's Hold",
      "type": "Safe Haven",
      "description": "Underground farms where Charles grows food in magical warmth"
    },
    {
      "name": "Resistance Camp",
      "type": "Settlement",
      "description": "Viking warriors who fight against the corruption"
    },
    {
      "name": "The Ghost Fleet",
      "type": "Dungeon",
      "description": "Ships frozen in ice, crewed by the corrupted dead"
    },
    {
      "name": "The Usurper's Throne",
      "type": "Boss Arena",
      "description": "Where Erik holds court over endless raiders"
    }
  ],
  
  "sideQuests": [
    "The Berserker's Cure",
    "Endless Winter",
    "Forgotten Runes",
    "The Ghost Fleet",
    "The Usurper's Throne",
    "The Wolf's Chain"
  ],
  
  "dimensionalAnchor": {
    "name": "Frostfire Axe",
    "description": "Burns with cold flame, warming allies and freezing enemies",
    "obtainedFrom": "Viking Nike after freeing him"
  },
  
  "ogForeshadowing": {
    "mention": "The Originals still carrying weight",
    "quote": "OG Nike feels every one of us â€” our joys, our fears, our deaths. That's the burden of being the foundation."
  }
}
